sentence,actionable_item
"Hi Carolyn, Please email me the execution version of the documents signed last week, as well as the current version of the other documents.",TRUE
wireless lan the infrastructure to support wireless lan technology is in place and is being tested,FALSE
com [image] at&t wireless [image] [image] [image] [image] [image] pal= len@enron,FALSE
Please still let me know where you guys are going to be and if anything changes I'll update you all.,TRUE
i thought it would be more likely for the distribution to be made off-cycle,FALSE
"a good cause, no doubt",FALSE
"move over 007, the pencam trio is the new age of digital cameras",FALSE
"commenting on cash management in the = quarter, frank dunn said, ""we are extremely pleased with the results that h= ave been generated from our focus on cash management, which drove a signifi= cant improvement in cash and contributed to positive cashflow from operatio= ns",FALSE
(please let me know who i left off the mailing list),FALSE
"busy bee, you don't *have* to check those bookmarks individually, says the guru",FALSE
"ah, but there was a flaw in that argument--one that is becoming glaringly clear as the price of gas plunges below $2 per million btu at the wellhead from as high as $10 last year",FALSE
"i trust this helps - let us know if you need anything further regards""",FALSE
"Also, I need you to update the unit serial numbers if you'd like them included in the agreement.",TRUE
68 = 3% shareholders' equity (billions) $ 12,FALSE
we will probably visit in late june or july,FALSE
"warmest regards, your list services team open2win if = for some reason you choose not to participate in the opt in network and get= free and heavily discounted offers, click here",FALSE
but the deposit was $495 more than the rentroll adds up to,FALSE
they want to see historical volumes at those location to judge the liquidity at each location,FALSE
(i will send an e-mail monday with the room number,FALSE
it would be good if we could have things signed by then so we can exchange funds,FALSE
"citibank market operations ""normal,"" and no problem with settlements today despite evacuation of ny office japanese officials report no discussion of fx intervention but that cooperative g-7 intervention available if necessary; boj injected y2 trillion to provide liquidity next regular boj policy meeting sept",FALSE
"the new generation is being sold solely as a four= -door sedan, although last year's camry solara continues as a coupe and co= nvertible",FALSE
"</o=enron/ou=na/cn=recipients/cn=dgiron>, giron, gustavo </o=enron/ou=na/cn=recipients/cn=ggiron>, goodell, scott </o=enron/ou=na/cn=recipients/cn=sgoodel>, grace jr",FALSE
> > actual result: took a truck and trailer to mexico and handpicked sautillo tiles > for inside the house,FALSE
"the third quarter restructuring charge inc= ludes severance costs for the elimination of approximately 6,100 jobs and a= sset impairment and other costs, all relating to the consolidation and reor= ganization of certain business units, the scale back of corporate lending i= n certain regions, the migration of certain processes to lower cost locatio= ns, the outsourcing of certain activities, and the transition of certain pr= ocessing and service functions to the internet",FALSE
"(id, company, address, city, state, zip, phone, sic, dun, sales, employee, contact, title) #418,896 records fortune #2 included fields",FALSE
html don't miss zdnet's holiday gift guide http://chkpt,FALSE
"in the southwest power pool, traders said warmer weather was the main culprit behind lower prices",FALSE
"</o=enron/ou=na/cn=recipients/cn=bgray>, van hooser, steve </o=enron/ou=na/cn=recipients/cn=svanhoo>, cook, mary </o=enron/ou=na/cn=recipients/cn=mcook>, nemec, gerald </o=enron/ou=na/cn=recipients/cn=gnemec>, ogden, mary </o=enron/ou=na/cn=recipients/cn=mogden>, st",FALSE
winter 2001 baseload traded as high as 21,FALSE
i thought you might want to contact him directly and ask him some questions,FALSE
the walls needed to convert the playroom to a bedroom should be minor construction,FALSE
source: market guide via factset research systems,FALSE
i spoke to jim fallon and we agreed that he should be in the excellent category,FALSE
"david; tricoli, carl; vickers, frank w",FALSE
i have added another post office for your consideration,FALSE
"also, the comps used in the appraisal from austin appear to be class a properties",FALSE
"=09=09=0f=07 =09=09buzz index in my yahoo! - the newest module on my yahoo! presents a d= aily=20 look at what's hot in television, movies, music, sports",FALSE
5 out of 5 stars showtimes: 12:20pm | 5:10pm | = 9:50pm | 12:30am the wash rdr,FALSE
", as well as in the top 10 nationally",FALSE
Please create data mapping from multiple data sources to a single domain model and send me the report.,TRUE
promotion exclude= s current sprint customers,FALSE
"[image] [image] [image] [image] [image] [image] = [image] [image] [image] [image] [image] [image] = [image] [image] [image] [image] [image] = [image] [image] [image] [image] [image] [image] = [image] [image] [image] [image] [image] = [image] [image] [image] [image] [image] [image] = [image] [image] [image] ec relaxes ""competition"" rules for v= iking project new cable would link germany to norway eon, statkraft win f= ull access to new capacity [image] [image] [image] [image] [ima= ge] [image] [image] [image] [image] [image] [im= age] cheap hydro dries up nordic countries search for new options in= terconnectors could help customer participation forces prices down [imag= e] [image] [image] [image] [image] [image] [image] [i= mage] [image] [image] [image] the number of tabled, c= anceled projects growing figures dwarfed by continuing project proposals a= nnouncements easy, follow-through isn't [image] [image] [image] = [image] [image] [image] [image] [image] [image] [i= mage] exxonmobil earnings drop by over 20% full story",FALSE
Get all the details in our special report.,TRUE
but the ipod isn't just some mischief at microsoft's expense,FALSE
the article was just one analyst's opinion,FALSE
_____________________david coursey_____________________ windows xp urban legends and myths--debunked! as the clamor about windows xp grows--it's being officially launched tomorrow--so does the confusion,FALSE
"new calculation, changes and display based on operational maximum with adjustments for maintenance",FALSE
"mid-continent area power pool peak spot power prices also climbed today, showing the largest increase in the region as above-normal temperatures were expected and transmission problems isolated the market from lower-priced eastern hubs",FALSE
"1017 ------------------------------------------------------------------ end order form ------------------------------------------------------------------ for more information, and available records contact us: #954-340-1018 voice or visit the website at: http://www",FALSE
"lucy, here is the rentroll for this friday",FALSE
"additionally, this candidate currently works in our london office as an analyst and is looking to come over to the houston office",FALSE
"</o=enron/ou=na/cn=recipients/cn=spereir>, perlman, beth </o=enron/ou=na/cn=recipients/cn=bperlman>, pollan, sylvia s",FALSE
john thompson 0% frank w,FALSE
move in or lease start date 2,FALSE
"the market couldn't sustain initial enthusiasm that the election drama was nearing a close, but the dow industrials finished up 26",FALSE
full review > > you are r= eceiving this special edition newsletter because you signed up to receive = information and updates from autoweb,FALSE
the credit center is a one-stop source for consumers to access a wealth of credit information,FALSE
registrations received after the first eight will be placed on a waiting list for the course or courses indicated,FALSE
"or vi= sit the cosmo gift guide 's boutique collection of presents for the ladies = on your list, including mom (plus treats for that special someone -- you)! = from yahoo! shopping and cosmopolitan magazine -- your favorite things for = the holidays or anytime",FALSE
peak next-day power at the zone a delivery point sold $6,FALSE
i already have my blueprints completed,FALSE
he feels this property would most likely warrant 7,FALSE
"i am expecting to pay something in the $3,000 to $5,000 range",FALSE
70% = mexico np 9,FALSE
"on another note, is it my imagination or did the sarr website lower its forecast for mcnary discharge during may",FALSE
"15 pounds a megawatt-hour, 2",FALSE
you are in elite company,FALSE
"TJ, Please provide me with the latest hard copy tonight so can have one final meeting with my direct reports to get final confirmation for East Power seating.",TRUE
we have to get this done next week,FALSE
"0) nasdaq (000) 1,920,993 (529,883",FALSE
(the swing receipt point) than 98 or 99,FALSE
"Doug, please collect all the comments on the document and get them to me ASAP tomorrow.",TRUE
Please have this acknowledgement letter reviewed as soon as possible.,TRUE
"* each team gets a private web site, including tons of scouting reports and fantasy analysis",FALSE
95% heating oil (nov) 0,FALSE
"latest example comes from bell labs, which unveiled a carbon transistor thousands of times smaller than those now inside a pentium 4",FALSE
Schedule informal meeting with FERC staff to educate and get advice on further steps.,TRUE
Please email your cost estimates when company confirm the plan,TRUE
ham= brecht coverage initiated at buy briefing,FALSE
that were built by reagan lehmann,FALSE
"(id, domain, contact, admin handle, admin name, admin email, admin phone, admin fax, billing handle, billing name, billing email, billing phone, billing fax, tech handle, tech name, tech email, tech phone, tech fax) #74,550 records maxdisc_city_state_zip_1",FALSE
com subject: marketer support of generator motion on credit issues cheryl ryan has raised the suggestion of a joint answer by the marketer group in support of the generators' recent motion on credit issues,FALSE
"considering #1 & #2 $115,000 noi is not necessarily overstated",FALSE
"just to clarify: for conversion, we were planning to cover problems where there is no perfect hedge so the learner has to find creative ways to hedge, as opposed to conversion of mmbtu to decatherms, conversion of oil volumes to natural gas volumes, etc",FALSE
"(id, domain, company, address, city, state or province, zip, country, first name, last name, email, phone, fax, title, meta description, meta keywords, body) #293,225 records maxdisc_meta_2",FALSE
"</o=enron/ou=na/cn=recipients/cn=jsinger>, knoblauh, jay </o=enron/ou=na/cn=recipients/cn=jknobla>, schockling, gregory </o=enron/ou=na/cn=recipients/cn=gschock>, mccairns, dan </o=enron/ou=na/cn=recipients/cn=dmccairn>, bond, ragan </o=enron/ou=na/cn=recipients/cn=rbond2>, rangel, ina </o=enron/ou=na/cn=recipients/cn=irangel>, gillette, lisa </o=enron/ou=na/cn=recipients/cn=lgillet>, blay, jennifer </o=enron/ou=na/cn=recipients/cn=jblay>, cook, audrey </o=enron/ou=na/cn=recipients/cn=acook>, seibel, teresa </o=enron/ou=na/cn=recipients/cn=tseibel>, benevides, dennis </o=enron/ou=na/cn=recipients/cn=dbenevid>, ngo, tracy </o=enron/ou=na/cn=recipients/cn=tngo>, harris, joanne </o=enron/ou=na/cn=recipients/cn=notesaddr/cn=b46a4bc0-204eeb5-862568e0-662259>, tate, paul </o=enron/ou=na/cn=recipients/cn=ptate>, bangle, christina </o=enron/ou=na/cn=recipients/cn=notesaddr/cn=4c85bf4e-8af4a71a-86256903-5550d3>, moran, tom </o=enron/ou=na/cn=recipients/cn=tmoran>, rawson, lester </o=enron/ou=na/cn=recipients/cn=lrawson>, hall, bob m </o=enron/ou=na/cn=recipients/cn=rhall3>, baxter, bryce </o=enron/ou=na/cn=recipients/cn=bbaxter>, dahanayake, bernard </o=enron/ou=na/cn=recipients/cn=bdahana>, deming, richard </o=enron/ou=na/cn=recipients/cn=rdeming>, bailey, derek </o=enron/ou=na/cn=recipients/cn=dbailey>, anderson, diane </o=enron/ou=na/cn=recipients/cn=danders2>, hunter, larry joe </o=enron/ou=na/cn=recipients/cn=jhunte2>, wallumrod, ellen </o=enron/ou=na/cn=recipients/cn=ewallumr>, bowen, bob </o=enron/ou=na/cn=recipients/cn=bbowen>, lees, lisa </o=enron/ou=na/cn=recipients/cn=llees>, sever, stephanie </o=enron/ou=na/cn=recipients/cn=ssever>, fisher, joni </o=enron/ou=na/cn=recipients/cn=jfisher>, gorny, vladimir </o=enron/ou=na/cn=recipients/cn=vgorny>, diamond, russell </o=enron/ou=na/cn=recipients/cn=rdiamon>, miroballi, angelo </o=enron/ou=na/cn=recipients/cn=amirobal>, ratnala, melissa k",FALSE
"co= rporate and other reported net expenses of $52 million, compared with $46 m= illion a year ago",FALSE
"com, and start planning for your indulgent min= i-vacation in a city near you",FALSE
* we calculate all the stats and standings for you,FALSE
"monica, the outlines you just dropped off are fine",FALSE
idf's and thus network resident applications and data will be off line on all ecs floors 3 through 6 from 10:00 a,FALSE
"however, i still don't understand which date will be used to determine the value and calculate how many shares",FALSE
Get feedback from GE today.,TRUE
"Early Next Week, send this also to Phillip Allen.",TRUE
hjug has been created to satisfy all the educational needs about java for all levels,FALSE
you should consult with a tax pr= ofessional or accountant to help you determine if a conversion is advantag= eous for you,FALSE
apache blasts excessive speculation in u,FALSE
Make sure all price and volatility curves have been final posted in Curve Manager.,TRUE
i didn't have time to finish it,FALSE
=============================================== current cardholders and individuals that have applied within the past 60 days are not eligible to take advantage of this offer,FALSE
Please follow the memo below and continue to keep Eastrans deliveries at zero until further notified.,TRUE
"hunter, here is portland's weekly fundamental presentation",FALSE
"follow me to financial freedom!! i am looking for people with good work ethics and extrordinary desire to earn at least $10,000 per month working from home! no special skills or experience required",FALSE
", ed; miller, stephanie; nicolay, christi l",FALSE
about pros pros revenue management is the world's leader in pricing and revenue optimization solutions and the pioneer and dominant provider of revenue management to the airline and energy industry,FALSE
"greg, i have been working with bill montez",FALSE
we need to find a solution,FALSE
"do we need to list balances due or just list the work completed as an asset and give consideration of $5,875 for the cash paid to the engineer and appraisor",FALSE
2) about a home in kingwood that had a poisonous strain of mold growing in the walls,FALSE
you can use the additional principal reduction to record prepayments,FALSE
"_________________________________ subscription information to remove yourself from this list, see: http://interactive",FALSE
we are spending christmas in houston with heather's sister,FALSE
"with best regards, jim wills > > - new analysis",FALSE
"subscribers (email address) #260,971 records webmaster (email address) #18,104 records **documents: this directory contains very informative discussions about marketing and commercial email",FALSE
"posted new notice(s) since our last check at 12/13/2000 4:00:01 pm, the newest notice looks like: capacity constraint, dec 13 2000 4:03pm, dec 14 2000 9:00am, dec 15 2000 8:59am, 2241, allocation - san juan lateral please click the following to go to the web site for detail",FALSE
__________________________________ technology alert from the wall street journal dec,FALSE
there are also speculators who trade the futures contracts with no intention of actually buying or selling the gas -- and often with little real knowledge of natural gas,FALSE
"jeff, here is the recap of the utilities i have paid since closing",FALSE
"-renovations), to compete with the quality of new construction",FALSE
"and so in honor of our national holiday i've assembled a list of things that, well, i can't be thankful for",FALSE
subject: check this out - << file: mvc-002f,FALSE
"02% nyse (000) 792,634 (915,281",FALSE
"= net income for the third quarter, adjusted for the restructuring and one-= time costs related to september 11th, was approximately $595 million, down = 19 percent",FALSE
"even with depressed gas prices, many coal plants are still cheaper to operate",FALSE
employees who are not able to take the course at enron can take a course at the princeton review office at the same $200 discount,FALSE
"include the project description, investors, business entity, please provide the names and numbers of prior investors",FALSE
"Get the latest enterprise application news, reviews and analysis.",TRUE
"the princeton review has agreed to handle registration for the event, so call (800) 2review to register",FALSE
"</o=enron/ou=na/cn=recipients/cn=kheathm>, hillis, kimberly </o=enron/ou=na/cn=recipients/cn=khillis>, maronge, bridget </o=enron/ou=na/cn=recipients/cn=bmarong>, marshall, lucy </o=enron/ou=na/cn=recipients/cn=lmarsha>, mcvicker, maureen </o=enron/ou=na/cn=recipients/cn=mmcvick>, phillips, cathy </o=enron/ou=na/cn=recipients/cn=cphilli>, rapacioli, marisa </o=enron/ou=na/cn=recipients/cn=eu/cn=recipients/cn=mrapacio>, schiller, marsha </o=enron/ou=na/cn=recipients/cn=mschil1>, schoppe, tammie </o=enron/ou=na/cn=recipients/cn=tstaggs>, stark, cindy </o=enron/ou=na/cn=recipients/cn=cstark>, taylor, liz </o=enron/ou=na/cn=recipients/cn=ltaylor>, tori wells <tori",FALSE
i don't know who needs this report,FALSE
the risk is that they have built in enough margin to give them room to manage the price risk,FALSE
"com>, valencia, laura </o=enron/ou=na/cn=recipients/cn=lvalenc>, westbrook, sharron </o=enron/ou=na/cn=recipients/cn=swestbr>, williamson, joannie </o=enron/ou=na/cn=recipients/cn=jwillia1> x-bcc: x-folder: \pallen (non-privileged)\allen, phillip k",FALSE
26 high esti= mate $0,FALSE
"0 content-type: text/plain; charset=us-ascii content-transfer-encoding: 7bit x-from: espinoza, veronica </o=enron/ou=na/cn=recipients/cn=vespino> x-to: brackett, debbie r",FALSE
"nick, there is a specific program that we are using to recruit, train, and mentor new traders on the gas and power desks",FALSE
"(id, city, state, zip) #39,175 records maxdisc_country_codes_1",FALSE
need to reschedule to the following week,FALSE
Make sure Enron and Oxy had project team in place asap and the resources are committed to do world class job on the January 29 submission and the 29th could be the end of the tournament.,TRUE
"don, jeff gosset runs the risk management group",FALSE
we expect the software company to be online provided we see any problems when we bring the systems back up,FALSE
good luck on the bike ride,FALSE
"pst the second edition of ""new gen weekly"" is available for download",FALSE
"we expressed the sentiment that the root cause of all these issues and concerns is the current composition (and non-independence) of the iso board, and suggested that the iso board situation should be the subject of the upcoming ferc audit of iso",FALSE
8 for sagewood with a rate 8,FALSE
"don't forget: the pencam trio is free*, please reply now! [image] *requires change of state-to-state long distance carrier to sprint, remaining a customer for 90 days and completion of redemption certificate sent by mail",FALSE
"Please review and be prepared to dicuss on FRIDAY morning, so we can take the decision.",TRUE
this request has been pending your approval for 28 days,FALSE
keith said he would sign for $75k cash/$250 equity,FALSE
Take another step towards its quest to acquire oil gas assets announced today that it has enlisted the services of Edison Oil and Gas Ltd.,TRUE
"2 means that a psa account is distributed all at once, as distinguished from another form of payout as may have been selected by a participant in his or her deferral agreement",FALSE
owners in seguin (follow up with phone calls to good potential buyers) 2,FALSE
"male (email address) #13,131,440 records female (email address) #6,074,490 records **marketmakers: active online investors email addresses",FALSE
com>@enron > > [mailto:imceanotes-+22jeff+20smith+22+20+3cjsmith+40austintx+2ecom > +3e+40enron@enron,FALSE
run query and check the other deals to make sure the time zone is correct because if not they will not be scheduled correctly for April.,TRUE
"</o=enron/ou=na/cn=recipients/cn=cfoster>, glover, sheila </o=enron/ou=na/cn=recipients/cn=sglover>, suh, jungsuk </o=enron/ou=na/cn=recipients/cn=jsuh>, taylor, mark e (legal) </o=enron/ou=na/cn=recipients/cn=mtaylo1>, tholt, jane m",FALSE
00 (30%) [image] discover more at amazon,FALSE
Please confirm with Sheila what time we will have the call this week and inform me.,TRUE
"lamar smith will be fired up to face the seahawks this week, because he began his career in seattle",FALSE
"once again, if you observe suspicious behavior, please call security at 3-6200",FALSE
"you can't bench martin, no matter how bad the matchup may be",FALSE
dear salomon smith barney client: your salomon smith barney trade confirmation(s) has been delivered to salomon smith barney access for online viewing,FALSE
"org >> women in technology international ( co-host ) for more than a decade, witi has successfully provided women in technology inspiration, education, conferences, on-line services, publications and an exceptional worldwide network of resources",FALSE
i would support matt lenhart's promotion to the next level,FALSE
<< file: rm01-9 rehearing drft1,FALSE
"in addition, an inv= estor conference call to discuss third quarter earnings results, operating = performance and other topics that may be raised during the discussion will = be held at 5:00 p",FALSE
Please contact Jon Alstad in my absence with any action items and input you may have in next coming days.,TRUE
now prices are beginning to fall in response these market responses,FALSE
please cc the following distribution list with updates: phillip allen (pallen@enron,FALSE
"with best regards, jim wills (roma and canyon lake are still available)",FALSE
"hertzberg and the negotiating group are looking to enron for creative ways to address ""the dwr contract problem"" in order to prevent the contracts from 1) killing the core/noncore deal and 2) forcing california to accept a structure focused on a state power authority headed-up by david freeman that does not include direct access",FALSE
"i have been speaking directly to the architect, engineer, and soils engineer",FALSE
"gentlemen, today i finally received some information on the status of the work done to date",FALSE
"5 million, the noi is $1,152,695",FALSE
"land and soft costs - initial draw $ 1,608,683",FALSE
his views seem well thought out,FALSE
Please email or call with an update.,TRUE
the cash to be escrowed is approx,FALSE
this means that you don't have to worry= =20 about who might be trying to contact your child,FALSE
th= e outlook is available under 'other reports,FALSE
"please note, changes may take up to one week to process",FALSE
request id : 000000000077129 request create date : 11/26/01 8:12:45 am requested for : judy,FALSE
"savings plan, please read this very important message",FALSE
"""ft"" and ""financia= l=20 times"" are trademarks of the financial times ltd",FALSE
edwards upgraded to buy from accu= mulate 09/10/2001 bernstein upgraded to outperform from mkt perform = 08/15/2001 merrill lynch downgraded to nt neut/lt accum from nt buy/lt = buy 06/22/2001 a,FALSE
fixed construction profit of $1,FALSE
"= [image] [image] worldcom wireless and at&t wireless, two of the nation's= premier wireless service carriers have the unique ability to handle all o= f your cellular service needs, from coast-to-coast",FALSE
you can keep a log on paper or on the computer,FALSE
bloomberg energy department 05/14 bloomberg daily power report table bloomberg u,FALSE
comis the leading interne= t provider of live market analysis for u,FALSE
please add mike grigsby to distribution list,FALSE
com give a gift subscription: http://give,FALSE
i am planning on writing a personal check to the engineer while i am setting up new accounts,FALSE
"+5% equity for meeting time and costs in original plan ($51/sq ft, phase 1 complete in november) +5% equity for under budget and ahead of schedule -5% equity for over budget and behind schedule this way if things go according to plan the final split would be 60/40, but could be as favorable as 55/45",FALSE
"in the payment section: for the course at enron, the tuition is discounted by $200, to $899",FALSE
"we have to fully understand the charts and how they are constructed, and we ran out of time today",FALSE
participants of previous pros seminars have found these sessions to be extremely helpful in improving their business and making them more valuable to their respective organizations,FALSE
in order to ensure minimal disruption to trading we are taking the following steps,FALSE
"Angela, please pick the 29th or 30th based on JLG's schedule and send to Tracy about the schedule.",TRUE
"then there is a layer of ""construction management"" fees of 10%",FALSE
Let's plan to talk about this on Monday.,TRUE
i told gordon you might call to inquire about what work he performed,FALSE
it may be a top running back facing= a sturdy run defender; a deep-threat wideout matched up with a premier co= ver-corner; or a gunslinging qb against a defense with ball-hawking safetie= s,FALSE
pst team here are my comments:,FALSE
"tara, this note is documentation of my approval of granting executing id's to the west cash traders",FALSE
"//////////// market brief tuesday, december 12 stocks close change % change djia 10,768",FALSE
"sample one of t= he free reports on yahoo! autos, like this best & worst used cars",FALSE
"Since your team is new, please check with everyone and let me know if you can make our next scheduled EDF meeting.",TRUE
"doc>> phillip, enclosed is the draft reimbursement agreement",FALSE
"John, please fix bugs and improve code by tomorrow.",TRUE
