sentence,actionable_item
09) n/= a n/a -------- ------- -------- ------- = $ (8,FALSE
"Hilliard, know the status of these contracts forwarded to you on August 23, 2000 and August 25, 2000.",TRUE
but here's the hitch: there's no windows version right now,FALSE
Inform the team that will continue to do everything in my power to serve the best interests of Enron's employees and shareholders.,TRUE
"if you want to give it a try, go to their website at www",FALSE
"; fulton, donna; dasovich, jeff; nicolay, christi; steffes, james; jalexander@gibbs-bruns",FALSE
"com, you indicated you wished to receive this business news alert e-mail",FALSE
"he'll be = facing a washington defense decimated by injuries and vulnerable to players= like muhsin muhammad, donald hayes and wesley walls",FALSE
we'll also highlight the key matchups i= n every nfl game to help you decide who to start and who to bench,FALSE
com> note: your ibuyit payables user id and password are your ehronline/sap personnel id and password,FALSE
also an undiscounted june 01 to january 02 spread of $0,FALSE
"content-transfer-encoding: 7bit x-from: frank, carole </o=enron/ou=na/cn=recipients/cn=cfrank2> x-to: reitmeyer, jay </o=enron/ou=na/cn=recipients/cn=jreitme>, ermis, frank </o=enron/ou=na/cn=recipients/cn=fermis>, smith, mark </o=enron/ou=na/cn=recipients/cn=msmith>, south, steven p",FALSE
Ensure there aren't any issues to work on this task.,TRUE
nsf please review the attached draft enron comments in response to the san diego request for natural gas price caps,FALSE
Please check design and requirements of all participants and design classes to suit individual need.,TRUE
Please check and give me call so we can discuss what the next step needs to be.,TRUE
provides links to e-loan as a convenience to its cli= ents and licenses the schwab mortgage center name to e-loan,FALSE
council member martha castex tatum was not present at the= meeting,FALSE
"please check into this and make sure they post it ASAP, especially since our time frame is quite tight.",TRUE
Delete with one simple keystroke and continue the same for the entire project.,TRUE
57% source: yah= oo! & tradingday,FALSE
_____________________david coursey_____________________ the 10 top things you must know about win xp reams have been written about xp,FALSE
Prepare the Letter and send it to ABB for their comments.,TRUE
com - nt upgrade/downgrade historya:visited { color:000066; }a:hover{ color:cc6600; } earnings,FALSE
then connect for less than $20= per month,FALSE
"cloud postulates that we spend too much time focusing o= n problems, rather than on root issues",FALSE
Let me know by Friday about your plan on attending.,TRUE
"i don't know if this matters to you but in case it does, just wanted you to know",FALSE
"the total 10 acres of co= mmercial allowed on the property is proposed limited to ""community commerci= al"" -- a yet to be established zoning district -- loosely defined as to ens= ure more compatibility with existing residential neighborhoods complete wit= h buffering and landscaping",FALSE
"under the private securities litigation reform act, we are required to preserve documents that might be used in the litigation",FALSE
i think crude price are undervalued by the tune of $10/share,FALSE
"; chang, fran; chen, andy; choi, paul; clark, e= d; comnes, alan; conwell, wendy; dalia, minal; davidson, debra; donovan, te= rry w",FALSE
"mike, here is my first pass at midyear reviews",FALSE
"for example, daily volume for natural gas financial swaps during this quarter has been 25 bcf(25,000 contracts) for 1 month trades, 20 bcf (20,000 contracts) for greater than 1 month trades, and 50 bcf (5,000 contracts) for less than 1 month trades",FALSE
flying somewhere takes too much time,FALSE
"thanks, heather -----original message----- from: allen, phillip k",FALSE
06 disc #6) available for $499,FALSE
"Jim, please find below the production schedule to update and review the regulatory component of the largest 50 curves 75 of net positions.",TRUE
"Sandra, just have to get with Chris Germany to see if he can confirm this deal.",TRUE
financing is the other consideration,FALSE
it might be possible to move the addition forward and open up the bedroom at the top of the stairs into the new space,FALSE
subject: enron center garage the enron center garage has opened,FALSE
shows you where to find great selections of art online (and get your picks delivered to your door),FALSE
88 to a bloomberg index of $205,FALSE
for purposes of paying back the two notes,FALSE
com remains a profitable dot-com,FALSE
i agree that you should be refunded any cash investment,FALSE
"(or any of its > affiliates) and the intended recipient or any other party, and may not > be relied on by anyone as the basis of a contract by estoppel or > otherwise",FALSE
whatever the risk was prior should not matter,FALSE
"however, we were invited to file written comments with the commission on what we thought should be audited, and alan is taking the lead on this",FALSE
"al, i was not going to do the ms this year",FALSE
generators need to revise expected usage,FALSE
"; grigsby, mike; krishnaswamy, jayant; lim, francis s",FALSE
est) topic: generation interconnection activitiesand related matters,FALSE
Also please review the following list of issues and others to be added so that can send CES an agenda.,TRUE
"participating for ferc were bob pease (enforcement att'y), stuart fisher (economist) and bruce poole (engineer)",FALSE
"joe linsalata integrity realty services 205 south commons ford road, no",FALSE
Make changes to the pricing in deal 413462 mentioned below.,TRUE
"com because you are a current or former subscriber (either free-trial or paid) to one of our web sites, http://www",FALSE
not enough forward hedging is done by the major ldcs,FALSE
"in order to protect your personal privacy, we do not share your personal information with outside parties",FALSE
"</o=enron/ou=na/cn=recipients/cn=jhughes>, hutchinson, michael </o=enron/ou=na/cn=recipients/cn=eu/cn=recipients/cn=mhutchin>, jackson, charlene </o=enron/ou=na/cn=recipients/cn=cjackso>, joseph earle <jearle@enron",FALSE
a psa account balance is reflected in shares of stock since the form of distribution is shares of stock,FALSE
but adversity teaches us more important lessons than prosperity,FALSE
"Richard, please see my changes to Schedule meeting with John and Rick and check the availability.",TRUE
"<br> now here's your chance to receive a great offer<br> (a <b><font color=""#ff0000"">free</font></b> cell phone with <b><font color=""#ff0000"">free</font></b> activation and delivery)<br> that includes top quality pcs wireless services",FALSE
org ) > digital eve ( www,FALSE
Try and pull together the support for these items and get back to me.,TRUE
com subject: credit watch list--week of 11/19/01 mime-version: 1,FALSE
keith holst sent you an email with the details,FALSE
"00 > galaxy - draw # 2 $ 223,259",FALSE
Participate in such transaction from the date of notice by ENA.,TRUE
Please change any of these numbers as is appropriate to reflect October's activities and check.,TRUE
pst the attachment summarizes all of the comments filed by other parties in this proceeding,FALSE
patti stepped up to fill the gap left by randy gay's personal leave,FALSE
"[image] [image] [image] [image] has been placed on hold, for you phillip! [image] [image] phillip, we are prepared to send you the necessary documents to claim your $500",FALSE
that sounds like a lot,FALSE
"--> <!--copy the table section including the opening and closing table tags, and paste the data where--> <!--you want the reassembled image to appear in the destination document",FALSE
"at the sp-15 delivery point in southern california, peak power dropped $186",FALSE
html sony pda jumps to 16-bit color http://chkpt,FALSE
"the econ= omy will recover anyway, says wyss, with absence of the package pinching = gdp growth in 2002 by only 0",FALSE
"25 higher on average at the chicago-based commonwealth edison hub, trading at $29",FALSE
"orders submitted and confirmed prior to november 20, 2001 will be honored",FALSE
"""i was getting worried,"" he said",FALSE
com subject: bishop's corner foundation engineer information we talked to bob braden about designing the foundations using the geottech information that we was done previously so as not to delay the permitting process,FALSE
"Susan, please be on the lookout for FE's tariff filings in compliance with this order.",TRUE
gary is planning to put an a/c in #35,FALSE
can the loan amount be adjusted based on new costs estimates,FALSE
68 3% shareholders' equity (billions) $ 12,FALSE
the meetings might be better if held in a round table discussion format,FALSE
asp =================================================================== please email advertising inquiries to us at mailto:advertise@multex,FALSE
"Therefore, please encourage your direct reports and managers to participate in the below events in order to secure candidates for your business area.",TRUE
Please call me to discuss this issue or schedule time to do the same.,TRUE
coalition aims to sell residential green power in r,FALSE
"</o=enron/ou=na/cn=recipients/cn=pallen>, arnold, john </o=enron/ou=na/cn=recipients/cn=jarnold>, grigsby, mike </o=enron/ou=na/cn=recipients/cn=mgrigsb>, martin, thomas a",FALSE
aefa re= sults reflect continued weakness in equity markets and narrower spreads on = the investment portfolio,FALSE
we= atherford filed suit against the city earlier this year as a result of vari= ous city commissions declining to approve re-zoning plans the landowner say= s were in synch with land uses deemed acceptable in the current sector two = plan,FALSE
"2000 tech re-weight); more importantly, the topix went through and closed below 1000 breaking down to early 1998 financial crisis lows",FALSE
in order= to reduce or eliminate the $5,FALSE
Find out who else from Enron is part of the Bush transition team.,TRUE
"items to be addressed are: ldc hedging, unbundling rates and infrastructure needs",FALSE
"john </o=enron/ou=na/cn=recipients/cn=cthomps4>, milnthorp, rob </o=enron/ou=na/cn=recipients/cn=rmilnth>, colwell, wes </o=enron/ou=na/cn=recipients/cn=wcolwel>, beck, sally </o=enron/ou=na/cn=recipients/cn=sbeck>, oxley, david </o=enron/ou=na/cn=recipients/cn=doxley>, deffner, joseph </o=enron/ou=na/cn=recipients/cn=jdeffne>, funkhouser, shanna </o=enron/ou=na/cn=recipients/cn=sfunkho>, gonzales, eric </o=enron/ou=na/cn=recipients/cn=egonzale>, kaminski, vince j </o=enron/ou=na/cn=recipients/cn=vkamins>, lawyer, larry </o=enron/ou=na/cn=recipients/cn=llawyer>, mahoney, chris </o=enron/ou=na/cn=recipients/cn=eu/cn=recipients/cn=cmahoney>, myers, thomas </o=enron/ou=na/cn=recipients/cn=tmyers>, nowlan jr",FALSE
"to cancel delivery of all e-reports, simply turn on vacation mode",FALSE
for more information please email us at kase@kaseco,FALSE
keith and i appreciate you meeting with us on sunday,FALSE
pcx) turn east on 518 turn left on marina bay drive turn left on south shore blvd,FALSE
"enron, mirant urge ferc to reject nevada complaints [image]full= story",FALSE
cgi</a> ********************************************************************* you received this e-mail because you registered on cbs sportsline,FALSE
sun/oss system: no scheduled outages,FALSE
avoid possible system delays near the deadline.,TRUE
"jaques, after meeting with george and larry, it was clear that we have different definitions of cost and profit",FALSE
your comments were very helpful,FALSE
"First thing in the morning, meet Davis for 20 minutes.",TRUE
enclosed please find the deed and the first amendment,FALSE
"you can send them to my home or office (1400 smith, eb3210b, houston, tx 77002)",FALSE
com subject: west natgas prices 1127 mime-version: 1,FALSE
"3 of the plan, a disagreement has arisen reg= arding the phantom stock account",FALSE
"excluding these items, aefa's net inc= ome would have been $194 million, down 28 percent from last year",FALSE
Check out this list of the points we plan to put on the map and let me know if we should eliminate or add based on traders requests Jan.,TRUE
let me know if you'd like a copy of any of them,FALSE
lot's > of cement approx,FALSE
"neither player looks like a great start, but we'll go with hilliard because of his experience and continuing improvement",FALSE
"_____________________david coursey_____________________ why the riaa owes us all an apology when recording industry types last week tried to get provisions against music swappers included in anti-terrorism legislation, they trivialized everyone involved in america's fight against terrorism--and proved themselves to be absolutely the sort of people who'd do anything for a buck",FALSE
she is also working on understanding the grid and the relationship between all the different trading points from opal to the mid-continent,FALSE
most of the local events are held at the houston engineering and scientific society (hess) building,FALSE
"though xp downloads are still hard to come by, preston has found three that let you tweak the os's look and optimize its performance",FALSE
i was wondering about alternatives,FALSE
com=09[image]=09 =09 [image] view today's upgrades/downgrades/coverage initiated briefing jd= s uniphase corporation (jdsu) date brokerage firm action details 10/2= 4/2001 j,FALSE
"5 out of 5 stars showtimes: 12:10pm | 1:05pm | 3:30pm | 4:35pm |= 7:10pm | 8:05pm | 10:10pm how high rmethod man, redman average cus= tomer review: 5 out of 5 stars showtimes: 11:00am | 1:15pm | 3:30pm | 6:= 00pm | 8:15pm | 10:30pm jimmy neutron: boy genius gdebi derryberry, ro= b paulsen showtimes: 11:05am | 11:40am | 1:10pm | 2:10pm | 3:40pm | 4:4= 0pm | 5:50pm | 7:10pm | 7:50pm | 9:15pm | 9:50pm joe somebody pgtim= allen average customer review: 1 out of 5 stars showtimes: 11:45am | 2:= 15pm | 4:45pm | 7:15pm | 9:45pm the lord of the rings: the fellowship = of the ring pg-13elijah wood, ian mckellen average customer review: 4",FALSE
keith and i would like to oversee the bookkeeping,FALSE
i look forward to hearing from you,FALSE
"</o=enron/ou=na/cn=recipients/cn=tdetmer>, dietrich, janet </o=enron/ou=na/cn=recipients/cn=notesaddr/cn=384eca1e-36846ef5-62569fb-57dcf1>, dimichele, rich </o=enron/ou=na/cn=recipients/cn=rdimichele>, dodson, keith </o=enron/ou=na/cn=recipients/cn=kdodson>, donahue, jeff </o=enron/ou=na/cn=recipients/cn=jdonahu>, duran, w",FALSE
"Please ask for the work, complete and submit by Monday, July 17, 2000.",TRUE
"</o=enron/ou=na/cn=recipients/cn=sscott5>, reitmeyer, jay </o=enron/ou=na/cn=recipients/cn=jreitme>, ermis, frank </o=enron/ou=na/cn=recipients/cn=fermis>, south, steven p",FALSE
Please check that Coral is not invoiced or paid on these deals and let me know by evening.,TRUE
"et topic: technical conference concerning west-wide price mitigation for winter season & procedures for seeking participation if you have an annual subscription to the capitol connection internet service, these meetings are included in the annual fee",FALSE
com =09[image] =09 =09 [image] view today's upgrades/downgrades/coverage initiated briefing = enron corp (ene) date brokerage firm action details 10/25/2001 banc = of america downgraded to mkt perform from strong buy 10/24/2001 prude= ntial securities downgraded to sell from hold 10/24/2001 j,FALSE
i have a suggested outline which you do not have to use but i thought it might help,FALSE
thanks for you= r patience,FALSE
"i still have questions on #28,#29, and #32",FALSE
"associate recruiting: saturday november 3 total - 70 candidates for interview analyst recruiting: friday, november 16 total - 70 candidates for interivew associate recruiting: saturday, december 1 total - 70 candidates for interview the above spreadsheet represents ena's particpation today which i believe highlights the need for much additional support in these efforts",FALSE
"do you need to incorporate this number is the release or can i just net this amount against the $11,000 and pay them the difference",FALSE
Go through the list of requests to determine which are in scope for this project and which fall out of scope.,TRUE
use yahoo! wallet and our secure web submission form,FALSE
"Lysa, make sure Paul gets this info.",TRUE
"Thanks, Monica Please send more details regarding this meeting.,True",TRUE
13 # of estimates 18 27 35 34 low estimat= e -$0,FALSE
this email address goes to my work,FALSE
"Also, please advise of the results of the conference call which you had with am working on the assignment and assumption agreement.",TRUE
com - utility construction escrow am (amhpleander),FALSE
"for additional information with respect to certain= of these and other factors, see the reports filed by nortel networks corpo= ration and nortel networks limited with the united states securities and ex= change commission",FALSE
"Also, make sure to submit your feedback in consolidated format and on the spreadsheet attached below only one feedback from each group at time instead of multiple feedbacks from different people.",TRUE
this is an open2win mailing! this message is sent to subscribers only,FALSE
"if you would prefer to settle the taxes with a personal check, we can distribute gross shares",FALSE
"internal candidates: benke terrell burt, bart freeman, scott giron, gustavo hamlin mason huang jason hull bryan jennaro jason lenart kirk lieskovsky jozef ordway chris pan steve royed jeff saavas leonidas schlesenger laura sell, max total: 16 external candidates: fred baloutch randy hebert ferando leija agustin leon zoya raynes carl zavattieri eric moncada gabe weinart total: 8 nb: awaiting feedback from 3 traders on 6 remaining external candidates",FALSE
"john, here is our north of stanfield forecast for jan",FALSE
edwards downgraded to buy from strong buy 09/26/2001 a,FALSE
"4040, option 4 or email: pep",FALSE
nepool asks ferc to approve new payment deal for enron [= image]full story,FALSE
"00 may be charged for early termination,= suspension, disconnection or downgrade of required directv programming",FALSE
hugo has completed a platt to combine into one lot and is ready to submit it to the city of san marcos,FALSE
"consumption, currently unseasonably low, was expected to rise with falling temperatures because of increased requirements for space heating",FALSE
"thanks, bob huntley ----- original message ----- from: <phillip",FALSE
we obviously have a lot to talk about,FALSE
"the following options are also available through the toll-free number: 0: connect to voice directory 1: transfer to an extension in the enron building 2: access voicemail in the enron building 3: transfer to 3 allen center 4: transfer to omaha 5: transfer modem or fax with 646 prefix 6: speak to an enron operator 7: transfer to a fax machine in the message center 8: transfer to aviation 9: leave a confidential message for enron chairman please contact the resolution center at 3-1411 for assistance ets customers should continue to contact the ets solution center-houston at 713-345-4745 or 888-465-4745, and the ets solution center-omaha at 402-398-7454",FALSE
"each day you plan to exercise outside, present your enron photo id badge or another form of photo id to the front desk receptionist to receive your temporary security smart id",FALSE
"fill out the student information completely, including your email address",FALSE
"commensurate with its announcement on = october 2, 2001 to align its resources around three businesses (metro netwo= rks, wireless networks and optical long haul networks), nortel networks wil= l evolve its financial reporting to reflect the new organization beginning = in the fourth quarter of 2001",FALSE
Join my husband at his officer's meeting in San Antonio.,TRUE
7% with no credit enhancement,FALSE
gif >> - phase 1,FALSE
environments impacted: corp trying to access dbases on the server,FALSE
"org subject: radiant heating date: tue, 4 jan 2000 11:28:29 -0500 mime-version: 1",FALSE
edwards upgraded to buy f= rom accumulate 09/10/2001 bernstein upgraded to outperform from mkt pe= rform 08/15/2001 merrill lynch downgraded to nt neut/lt accum from nt= buy/lt buy 06/22/2001 a,FALSE
pst enron employees not participating in contract parking are eligible to receive metro bus passes or woodlands express passes,FALSE
Make sure we are protected from any liability caused by their delay.,TRUE
Please find the lastest versions of the Protocols both clean and redlined versions and their cover pleadings.,TRUE
"gary, i have also been speaking to johnnie brown in san antonio to be the general contractor",FALSE
"Serena, Please use the new sheet to schedule the upcoming meetings.",TRUE
i received the check from pauline that was > due may 20th,FALSE
especially if you have to prepare a presentation,FALSE
phillip allen has made this my number one priority,FALSE
13 higher at a bloomberg index price of $70,FALSE
this procedure can only be used to call 800-97-enron from worldphone international locations,FALSE
there is only one change - pgt 2003 expansion,FALSE
this needs to be written in on their lease,FALSE
purpose: to replace a bad hard drive,FALSE
"com> > subject: > > > jacques, > > have you received the assignment letter from marcus kolb",FALSE
please talk to your KN trader regarding this situation tomorrow.,TRUE
ferc backs texas co-op in pass-through dispute [image]full story,FALSE
"; kingerski, harry; kaufman, paul; tycholiz, barry; miller, stephanie; ponce, roger; black, don; hewitt, jess; shireman, kristann; courtney, mark; elliott, chris; dasovich, jeff; becky mccabe; fulton, donna; steffes, darla; stoness, scott; johnson, tamara cc: nicolay, christi subject: ca instrate gas matters this is to quickly summarize our call on july 11 on california gas intrastate matters and set a direction for future activity",FALSE
i will call the bank again today to resolve authorization on the account,FALSE
"; garner, bruce subject: competitive analysis update #4- us terrorism attacks importance: high report is divided into market updates; transportation/infrastructure updates; and political updates",FALSE
"technicals are taught in a logical, systematic manner oriented to equip both physical and paper traders to buy low, sell high and manage risk in the real world in a logical, methodical manner",FALSE
janice finds an affordable phone that fits the bill,FALSE
"com --> </table> <!--------------------------- stop copying the html here ---------------------------> <p>[ <a href=""http://www",FALSE
"and to no one's surprise, will feature some of the musings/wisdom/experience of our master of lime, 'arry",FALSE
"subject: re: phillip, their attorney has not contacted me",FALSE
"33, amid trades in the $67",FALSE
com - jdsu upgrade/downgrade history earnings,FALSE
we're going to get 15+%,FALSE
i am having a hard time justifying paying much more with competition on the way,FALSE
"this two-day event will combine a venture educational symposium with an opportunity for linking investors and related financial organizations with select ventures in biotechnology, healthcare services, medical devices and life sciences",FALSE
00 > davis color stain 4lbs per yd x 100 yds x $18 lb $7200,FALSE
00 % su= rprise 3,FALSE
"pro forma net loss from continuing operations(a) for the third qua= rter of 2001, excluding incremental provisions and other charges, was us$85= 4 million or us$0",FALSE
"(legal); lindberg, susan subject: re: marketer support of generator motion on credit issues we should definitely support it",FALSE
they are on the attached memo,FALSE
"09 > > total paid to date cash $ 2,081,942",FALSE
"the following assumptions were made to establish our bid: 5% daily injection capacity, 10% daily withdrawal capacity, 1% fuel (injection only), 0",FALSE
i have forwarded him your resume,FALSE
"(alaska, arizona, california, colorado, connecticut, hawaii, idaho, illinois, iowa, kansas, maine, massachusetts, michigan, minnesota, missouri, montana, nebraska, nevada, new hampshire, new jersey, new mexico, new york, north dakota, ohio, oklahoma, oregon, rhode island, south dakota, texas, utah, vermont, washington, wisconsin, wyoming) included fields",FALSE
org or send an email to lisa@techxans,FALSE
you are subscribed as [{(pallen@enron,FALSE
we left very optimistic about the prospect of working with you on this project,FALSE
"jacques, glad to hear their attorney contacted you",FALSE
this request has been pending your approval for 55 days,FALSE
html check out sony's music machine http://www,FALSE
"Susan, please implement Mr.Smith's request soon.",TRUE
"com (where ""name"" is an abbreviation, acronym or alternative to an employees firstname and/or lastname)",FALSE
Read how Jeff would solve the problems in California and apply in our project.,TRUE
the first disc ver 4,FALSE
i think my folks are ready to start building,FALSE
look at storage graph on gas select,FALSE
i am planning to build a home in san marcos as soon as i can decide on a builder and materials,FALSE
season structures traded on the u,FALSE
it is my understanding that some rock will be removed and replaced with siding,FALSE
the provision for losses on the lending portfolios grew as a result of = higher volumes and an increase in u,FALSE
janice hunts for bargains (and freebies!) that'll rev you up in no time,FALSE
she wants reimbursement for the bills that i am faxing to you,FALSE
"> > we have shown this info and flyers to several people, so do let us > know > if you are interested in any of them",FALSE
"th= us, overall i am comfortable with the hard cost numbers at this point",FALSE
Please supervise all customer and company staff in all TD operations.,TRUE
) must enter the sprint double your winnings sweepstakes to be eligible to have winnings in iwon sweepstakesdoubled,FALSE
Make sure to follow up with the Seller about the fireplace.,TRUE
"Please document the sale and the other bids, timing issues, costs, and any other factors that led to or affected the sale.",TRUE
