sentence,actionable_item
", rob </o=enron/ou=na/cn=recipients/cn=rwalls>, wasaff, george </o=enron/ou=na/cn=recipients/cn=gwasaff>, whalley, greg </o=enron/ou=na/cn=recipients/cn=gwhalle> x-cc: teal, donna </o=enron/ou=na/cn=recipients/cn=notesaddr/cn=359d12db-1a7014e6-86256989-4d650c>, adams, jennifer </o=enron/ou=na/cn=recipients/cn=notesaddr/cn=c8c6afac-aee2bc3e-86256a9c-66391b>, adams, rachael ( metals ) </o=enron/ou=na/cn=recipients/cn=eu/cn=recipients/cn=radams>, alder, amelia </o=enron/ou=na/cn=recipients/cn=aalder>, alvarez, gloria </o=enron/ou=na/cn=recipients/cn=galvare2>, angelos, megan </o=enron/ou=na/cn=recipients/cn=mangelos>, armstrong, julie </o=enron/ou=na/cn=recipients/cn=jarmstr>, bates, kimberly </o=enron/ou=na/cn=recipients/cn=kbates>, benner, martha </o=enron/ou=na/cn=recipients/cn=mbenner>, boling, rosario </o=enron/ou=na/cn=recipients/cn=rboling>, bourgeois-galloway, hilda </o=enron/ou=na/cn=recipients/cn=hbourge>, braden, erica </o=enron/ou=na/cn=recipients/cn=ebraden>, brelsford, loretta </o=enron/ou=na/cn=recipients/cn=lbrelsf>, brown, ruth ann </o=enron/ou=na/cn=recipients/cn=notesaddr/cn=c5066cc1-99bc3768-86256737-82635f>, campos, kathy </o=enron/ou=na/cn=recipients/cn=kcampos>, cappelletto, nella </o=enron/ou=na/cn=recipients/cn=ncappel>, carroll, lillian </o=enron/ou=na/cn=recipients/cn=lcarro2>, collett, crissy </o=enron/ou=na/cn=recipients/cn=ccollett>, crenshaw, shirley </o=enron/ou=na/cn=recipients/cn=scrensh>, cromwell, sheri l",FALSE
"forecasters from lexington, massachusetts-based weather services corp",FALSE
"still, another trader said 170 percent above normal was a ""more realistic expectation following recent over-estimation of wet outlooks",FALSE
let me know what else i need to do,FALSE
"</o=enron/ou=na/cn=recipients/cn=pbroder>, bronstein, mara </o=enron/ou=na/cn=recipients/cn=mbronst2>, brooks, loretta </o=enron/ou=na/cn=recipients/cn=lbrooks>, brundrett, clifton </o=enron/ou=na/cn=recipients/cn=cbrundre>, bryan, gary </o=enron/ou=na/cn=recipients/cn=gbryan>, bryant, rachel </o=enron/ou=na/cn=recipients/cn=rbryant2>, burk, bart </o=enron/ou=na/cn=recipients/cn=bburk>, burnett, lisa </o=enron/ou=na/cn=recipients/cn=lburnett>, buss, jerome </o=enron/ou=na/cn=recipients/cn=jbuss2>, canacoo, tetteh </o=enron/ou=na/cn=recipients/cn=tcanacoo>, capasso, joe </o=enron/ou=na/cn=recipients/cn=jcapasso>, cardenas, catalina </o=enron/ou=na/cn=recipients/cn=ccardena>, carson, mike </o=enron/ou=na/cn=recipients/cn=mcarson2>, chang, sheila </o=enron/ou=na/cn=recipients/cn=schang2>, chen, hai </o=enron/ou=na/cn=recipients/cn=hchen2>, chilkina, elena </o=enron/ou=na/cn=recipients/cn=echilkin>, chiu, lindon </o=enron/ou=na/cn=recipients/cn=lchiu>, choate, jason </o=enron/ou=na/cn=recipients/cn=jchoate>, cline, kevin </o=enron/ou=na/cn=recipients/cn=kcline>, clyatt, julie </o=enron/ou=na/cn=recipients/cn=jclyatt>, clynes, terri </o=enron/ou=na/cn=recipients/cn=tclynes>, collins, dustin </o=enron/ou=na/cn=recipients/cn=dcollin>, colwell, wes </o=enron/ou=na/cn=recipients/cn=wcolwel>, concannon, ruth </o=enron/ou=na/cn=recipients/cn=rconcan>, cuilla, martin </o=enron/ou=na/cn=recipients/cn=mcuilla>, curry, mike </o=enron/ou=na/cn=recipients/cn=mcurry>, dalton iii, oscar </o=enron/ou=na/cn=recipients/cn=odalton>, davis, mark dana </o=enron/ou=na/cn=recipients/cn=mdavis>, day, amanda </o=enron/ou=na/cn=recipients/cn=aday2>, day, smith l",FALSE
"phillip, ina scheduled the conference room for tomorrow, so she's probably already got it on your schedule, but fyi - our meeting will be in the new enron building, room 6104",FALSE
it is ok to let the deposit rollover on #13 if there is no interruption in rent,FALSE
"in the second installment of this two-part story, bill speaks out on xp's controversial activation technology, the company's upcoming tablet pc, wireless standards, and more",FALSE
"i know that sue mara spoke with ron on this subject also, although i was not on the call",FALSE
here are my comments: agustin leon: has a lot of experience with quantitative and technical analysis,FALSE
"</o=enron/ou=na/cn=recipients/cn=jtholt>, ward, kim s (houston) </o=enron/ou=na/cn=recipients/cn=kward>, whitt, mark </o=enron/ou=na/cn=recipients/cn=mwhitt>, wolfe, jason </o=enron/ou=na/cn=recipients/cn=jwolfe> x-cc: x-bcc: x-folder: \pallen (non-privileged)\allen, phillip k",FALSE
"""there's no need for air conditioning, and no need for heating",FALSE
", all rights reserved about us | contact us |= webmaster | site map privacy policy | terms of service =09",FALSE
"in the body shop, studio b",FALSE
equipment specifications and programming op= tions may vary in alaska and hawaii,FALSE
"; smith, matt; sullivan, patti; superty, robert; tholt, jane m",FALSE
"these are the complete list of trades from enron online (eol), enron's direct phone conversations, and three brokerage firms (amerex, apb, and prebon)",FALSE
) bacon-wrapped filets (1144byg) reg,FALSE
hambrecht downgraded to buy from strong buy 06/22/2001 soundview u= pgraded to strong buy from buy 06/15/2001 wachovia securities downgrad= ed to neutral from buy 06/15/2001 csfb downgraded to hold from buy = 06/15/2001 s g cowen downgraded to neutral from buy 06/15/2001 abn= amro downgraded to hold from add 06/12/2001 credit lyonnais coverag= e initiated at hold 05/31/2001 cibc world markets downgraded to hold = from strong buy 05/30/2001 morgan stanley downgraded to neutral from = outperform 04/25/2001 dain rauscher wessels downgraded to buy aggressi= ve from strong buy 04/24/2001 raymond james downgraded to mkt perform= from strong buy 04/24/2001 mcdonald investments coverage initiated a= t hold 04/20/2001 w,FALSE
-- subscription information -- the e-mail address for your subscription is: pallen@enron,FALSE
"regarding the financing, i am working with jim murnan at pinnacle mortgage here in houston",FALSE
we think the s&p 500 and nas= daq will see double-digit gains over the course of 2002,FALSE
Please verify to provide copy of the blanket permit with the filing.,TRUE
customizing it more for the trading group,FALSE
we honor all removal requests,FALSE
"Steven, In addition to the potential State Board of Equalization regulatory reversal we discussed this morning, please also promote that AB 81 Migden is being gutted and amended to provide for SBOE assessment of all electric generating facilities that produce 50 MW or more of generation.",TRUE
"subject: west position attached is the delta position for 1/18, 1/31, 6/20, 7/16, 9/24 << file: west_delta_pos",FALSE
no more expenditures on office or landscape than is necessary for basic operations,FALSE
i have changed the unit mix to include some 1 bedrooms and reduced the number of buildings to 12,FALSE
"to a= nswer your second question, we'd recommend davis against a vulnerable carol= ina defense and dayne against philadelphia",FALSE
click on sports camp parent connection,FALSE
Please plan to have the data rerouted back down the target line for Daren.,TRUE
com re= ference priority code 788 to receive this limited-time discount price,FALSE
no new information on restart,FALSE
all the traders came to depend on the information patti provided,FALSE
"click here for: contract agenda monday, dec",FALSE
htm __________________________________ advertisement an ibm e(logo)server pseries solution for e-business infrastructure can meet the needs of the toughest financial environment,FALSE
"and in divisional games, big players do well",FALSE
she was mad about not being told about the transfer before it happened,FALSE
"to unsubscribe from future mailings, visit: http://www",FALSE
"stephanie please grant paul the requested eol rights thanks, phillip",FALSE
48 industry oil-us exp&pro 32,FALSE
you mentioned that this was applied to the cost of the land and it actually represents your cash investment in the land,FALSE
please update all records on research process and maintain it on filling system and ensure proper storage.,TRUE
"com e-greeting cards featuring holiday photos from the new york times photo archives, and download a new holiday screensaver that includes ten photographs from the times celebrating the magical season in the city",FALSE
"Kathleen, please add Fred Lagrasta, Vice President for signature authority for ENA Upstream Company ASAP.",TRUE
> > let me know what you want to do,FALSE
"thanks! -jay -----original message----- from: allen, phillip k",FALSE
"jpg"" width=303 height=254 border=""0""></a></td> </tr> </table> <!-- end imageready slices --> <table width=""486"" border=""0"" cellspacing=""0"" cellpadding=""0""> <tr> <td> <center> <b><font size=""5"" face=""verdana, arial, helvetica, sans-serif""><i><a href=""http://www",FALSE
"phillip, carlos and i are almost ready to email you a ""post office"" spreadsheet",FALSE
williams proposes western frontier pipeline full = story,FALSE
the attachment was not attached,FALSE
please start showing the West orig as Gas web from today onwards.,TRUE
"second, the language in section 6",FALSE
html how to build 'customer delight' http://chkpt,FALSE
"William Kasemervisz, make sure your group is looking out for the new update.",TRUE
Please check with Kim on the location and whether future dates are set or not .,TRUE
hugo is going to fax me a written letter of the scope of work he has been engaged to complete,FALSE
"com, you'll find the ""holiday & vine food and wine guide,"" to help you plan your holiday meals",FALSE
in the wake of competition = many utilities have reinvented themselves as retail operations whose main a= ssets are customers,FALSE
tycholiz 0% brian redmond 100% c,FALSE
"=09 =09 =09[image] =09[image] =09 =09 =09 =09 =09 =09 =09 =09 =09[image] =09 =09 =09 =09[image] =09[image] =09 =09 =09 =09 =09 =09 =09[image] =09 =09 =09 =09 =09 =09[image] =09[image] =09 =09 =09[image] =09 =09 =09 =09 =09 =09 =09 =09 =09 =09 =09[image] =09 =09 =09[image] =09 =09 =09 =09 =09 =09 =09 =09 =09 =09 =09[image] =09 =09 =09[image] =09 =09 =09 =09 =09 =09 =09 =09 =09 =09 =09[image] =09 =09 =09[image] =09 =09 =09 =09 =09 =09 =09 =09 =09 =09 =09[image] =09 =09 =09[image] =09 =09 =09 =09 =09 =09 =09 =09 =09 =09 =09[image] =09 =09 =09[image] =09 =09 =09 =09 =09 =09 =09 =09 =09 =09 =09[image] =09 =09 =09[image] =09 =09 =09 =09 =09 =09 =09 =09 =09 =09 =09 =09 =09 =09[image] =09 =09 =09 =09 =09 =09 =09 =09 =09 =09 =09[image] =09 =09 =09 =09 =09 =09 =09 =09 =09 =09 =09 =09 =09[image] =09[image] =09 =09 =09[image] =09 =09 =09 =09 =09 =09 =09 =09 =09 =09 =09[image] =09 =09 =09[image] =09 =09 =09 =09 =09 =09 =09 =09 =09 =09[image] =09[image] =09 =09 =09 =09 =09 =09 =09 =09 =09 =09 =09 =09 =09[image] =09[image] =09 =09 =09[image] =09 =09 =09 =09 =09 =09 =09 =09 =09 =09[image] =09[image] =09 =09 =09 =09 =09[image] =09 =09 =09 =09 =09 =09 =09 =09capital markets love energy-related firms =09energy companies dominate stock offerings, ipos =09 =09generators garner the most attention, money =09 =09good times bound to end =09 =09[image] =09[image] =09 =09 =09 =09 =09 =09 =09 =09[image] =09 =09 =09[image] =09 =09[image] =09[image] =09 =09 =09 =09 =09 =09 =09 =09 =09 =09 =09 =09 =09[image] =09[image] =09 =09 =09 =09 =09 =09 =09 =09 =09 =09 =09 =09 =09[image] =09[image] =09 =09 =09 =09 =09[image] =09 =09 =09 =09 =09 =09 =09mollusks create mayhem for power plants =09costs high to fight zebra mussels =09 =09authorities warn of other damaging invaders =09 =09 =09[image] =09[image] =09 =09 =09 =09 =09 =09 =09 =09[image] =09 =09[image] =09 =09 =09[image] =09[image] =09 =09 =09 =09 =09 =09 =09 =09 =09 =09 =09 =09 =09[image] =09[image] =09 =09 =09 =09 =09 =09 =09 =09 =09 =09 =09 =09 =09[image] =09[image] =09 =09 =09 =09 =09[image] =09 =09 =09 =09 =09 =09 =09gas use for power generation leveled out in 2000 =09coal still fuel of choice =09 =09value to balanced-fuel portfolio =09 =09 =09[image] =09[image] =09 =09 =09 =09 =09 =09 =09 =09[image] =09 =09 =09[image] =09 =09[image] =09[image] =09 =09 =09 =09 =09 =09 =09 =09 =09 =09 =09 =09 =09[image] =09[image] =09 =09 =09 =09 =09 =09 =09 =09 =09 =09 =09 =09 =09[image] =09[image] =09 =09 =09florida power outlines benefits of lat year=01,s merger =09go to full story",FALSE
supply will inevitablely increase to drive this market more in balance,FALSE
"gif"" border=""0"" width=""14"" height=""11""><img src=""http://images",FALSE
from a logistics standpoint this probably would be the best way to handle it,FALSE
"__________________________________ business alert from the wall street journal october 24, 2001 amr corp",FALSE
"gjohn goodman, billy crystal average customer review: 4",FALSE
"throw in the cost of scrubbers and other required pollution controls, and many smaller coal plants will have to be shut down, bergstrom says",FALSE
"Lisa Alfaro, get look at the assignment provisions so that, Brett and Enron can know what his constraints are with respect to possible sale.",TRUE
"</o=enron/ou=na/cn=recipients/cn=tmartin>, martinez, jennifer </o=enron/ou=na/cn=recipients/cn=jmarti2>, maskell, david </o=enron/ou=na/cn=recipients/cn=dmaskell>, mathews, reagan </o=enron/ou=na/cn=recipients/cn=rmathew>, mattice, robert </o=enron/ou=na/cn=recipients/cn=rmattice>, may, larry </o=enron/ou=na/cn=recipients/cn=lmay2>, may, tom </o=enron/ou=na/cn=recipients/cn=tmay>, mcelreath, alexander </o=enron/ou=na/cn=recipients/cn=amcelrea>, mckay, brad </o=enron/ou=na/cn=recipients/cn=bmckay>, mckay, jonathan </o=enron/ou=na/cn=recipients/cn=jmckay1>, merola, jeff </o=enron/ou=na/cn=recipients/cn=jmerola>, michels, david </o=enron/ou=na/cn=recipients/cn=dmichels>, migliano, andrew </o=enron/ou=na/cn=recipients/cn=amiglian>, miller, jeffrey </o=enron/ou=na/cn=recipients/cn=jmiller>, miller, stephanie </o=enron/ou=na/cn=recipients/cn=smiller2>, mims, patrice l",FALSE
"the shockwave installer can be found within ""about enrononline"" on the home page",FALSE
"if you call him, he will direct it to me anyway",FALSE
"also, i want to learn as much as possible from the process",FALSE
market data: no scheduled outages,FALSE
"cfm thank you, joe linsalata integrity realty services 205 south commons ford road, no",FALSE
"; zufferli, john cc: belden, tim; swerzbin, mike; richey, cooper subject: western strategy session charts for today's briefing are attached:",FALSE
= edwards upgraded to accumulate from maintain position 12/15/2000 bear= stearns coverage initiated at attractive 07/19/2000 paine webber upg= raded to buy from attractive 04/13/2000 first union capital upgraded t= o strong buy from buy 04/13/2000 salomon smith barney coverage initiat= ed at buy 04/05/2000 dain rauscher wessels upgraded to strong buy from= buy 04/05/2000 first union capital coverage initiated at buy bri= efing,FALSE
sometimes it is a real pain to line up at the= bank to shop for loans,FALSE
"the office of the chairman agrees to grant origination to the denver desk as follows: october 2000 $1,395,000 november 2000 $1,350,000 december 2000 $1,395,000 january 2001 $ 669,600 february 2001 $ 604,800 march 2001 $ 669,600 april 2001 $ 648,000 may 2001 $ 669,600 june 2001 $ 648,000 july 2001 $ 669,600 august 2001 $ 669,600 september 2001 $ 648,000 october 2001 $ 669,600 november 2001 $ 648,000 december 2001 $ 669,600 this schedule represents a demand charge payable to nbp energy pipelines by the denver desk",FALSE
"however, there is a strong possibility that ops may grant the system permission to return to it's full capacity at 1",FALSE
Coordinate with UI Programmer to strategize and execute user interfaces.,TRUE
Relieve the local congestion related to the wind generation projects in the Rio Pecos area.,TRUE
"sent: monday, november 26, 2001 11:18 am to: oxley, david subject: re: answer david, for clarity, wherever you cite section 6",FALSE
the company is profitable with year 2000 revenue of $29 million,FALSE
Please ensure you log out at night in order to receive the upgrade.,TRUE
"</o=enron/ou=na/cn=recipients/cn=deubank>, patel, sheetal </o=enron/ou=na/cn=recipients/cn=spatel2>, lavorato, john </o=enron/ou=na/cn=recipients/cn=jlavora>, o'leary, martin </o=enron/ou=na/cn=recipients/cn=notesaddr/cn=ed09f29a-67636184-8625677b-4fa04a>, mahmassani, souad </o=enron/ou=na/cn=recipients/cn=smahmass>, singer, john </o=enron/ou=na/cn=recipients/cn=notesaddr/cn=89ef66e3-9ba10bc8-8625685f-63df5a>, knoblauh, jay </o=enron/ou=na/cn=recipients/cn=jknobla>, schockling, gregory </o=enron/ou=na/cn=recipients/cn=gschock>, mccairns, dan </o=enron/ou=na/cn=recipients/cn=dmccairn>, bond, ragan </o=enron/ou=na/cn=recipients/cn=rbond2>, rangel, ina </o=enron/ou=na/cn=recipients/cn=irangel>, gillette, lisa </o=enron/ou=na/cn=recipients/cn=lgillet>, green, ron </o=enron/ou=na/cn=recipients/cn=notesaddr/cn=ea5e111-ab56e187-8625687b-1ac9c>, blay, jennifer </o=enron/ou=na/cn=recipients/cn=jblay>, cook, audrey </o=enron/ou=na/cn=recipients/cn=acook>, seibel, teresa </o=enron/ou=na/cn=recipients/cn=tseibel>, benevides, dennis </o=enron/ou=na/cn=recipients/cn=notesaddr/cn=f380d26c-f74d47d4-862564de-65ee01>, ngo, tracy </o=enron/ou=na/cn=recipients/cn=tngo>, harris, joanne </o=enron/ou=na/cn=recipients/cn=notesaddr/cn=b46a4bc0-204eeb5-862568e0-662259>, tate, paul </o=enron/ou=na/cn=recipients/cn=ptate>, bangle, christina </o=enron/ou=na/cn=recipients/cn=notesaddr/cn=4c85bf4e-8af4a71a-86256903-5550d3>, moran, tom </o=enron/ou=na/cn=recipients/cn=tmoran>, rawson, lester </o=enron/ou=na/cn=recipients/cn=lrawson>, hall, bob m </o=enron/ou=na/cn=recipients/cn=rhall3>, baxter, bryce </o=enron/ou=na/cn=recipients/cn=bbaxter>, dahanayake, bernard </o=enron/ou=na/cn=recipients/cn=bdahana>, deming, richard </o=enron/ou=na/cn=recipients/cn=rdeming>, bailey, derek </o=enron/ou=na/cn=recipients/cn=dbailey>, anderson, diane </o=enron/ou=na/cn=recipients/cn=danders2>, hunter, larry joe </o=enron/ou=na/cn=recipients/cn=jhunte2>, wallumrod, ellen </o=enron/ou=na/cn=recipients/cn=ewallumr>, bowen, bob </o=enron/ou=na/cn=recipients/cn=bbowen>, lees, lisa </o=enron/ou=na/cn=recipients/cn=llees>, sever, stephanie </o=enron/ou=na/cn=recipients/cn=ssever>, fisher, joni </o=enron/ou=na/cn=recipients/cn=notesaddr/cn=235a0375-7a9ca7b2-862566bd-7c5ae3>, gorny, vladimir </o=enron/ou=na/cn=recipients/cn=vgorny>, diamond, russell </o=enron/ou=na/cn=recipients/cn=rdiamon>, miroballi, angelo </o=enron/ou=na/cn=recipients/cn=amirobal>, ratnala, melissa k",FALSE
"then, susan and i will both go to denver in late may or early june to meet industry people and to complete the transfer of operations to the houston office",FALSE
"Contribute to all team effort through attaining related results for next week, so we can start new team.",TRUE
com has thousands of other free reports for you to check out,FALSE
"andy, i don't know what your need for brokerage services are, but scott is nice enough as far as brokers go",FALSE
"jacques, keith and i were able to resolve our concerns about having the gp as a corporation",FALSE
"x-folder: \pallen (non-privileged)\allen, phillip k",FALSE
55% = germany dax 4660,FALSE
jeff had been serving as chairman and ceo of enron industrial markets,FALSE
at money market rates of 3,FALSE
included in third quarter results are $84 million pre-tax= ($57 million after-tax) of the restructuring charge noted earlier,FALSE
67% =09palo verde (jun) =09365,FALSE
"Pease give us the GMS deal number,and if you know the riskworks deal number.",TRUE
please remove me from all future distributions and send me the remaining list.,TRUE
"the day-ahead system average area price fell after demand was expected to remain limited until next week, when forecasts predict temperatures to begin falling",FALSE
please find attached the Contract Schedule Summary between Enron and PG E.,TRUE
"some key milestones over the past 120 day= s included: -- the first north american ilec began the circuit to = packet transition with the deployment of our carrier-grade = softswitch; -- announced metro dwdm wins in the united states, europe = and japan; -- announced multiservice backbone awards (atm, ip,= mpls) in china, germany and asia; -- continued progress on 3g= wireless internet infrastructure deployments and completed the fir= st commercial umts test calls and the first cdma2000 1x mobile ip c= all; -- introduced advances in ip solutions, including an integrated = layer 4-7 content switching capability on our layer 2-3 edge = switch router; and -- completed hardware design, significantly advanc= ed software integration and began production of optera connect hdx = solution",FALSE
"(c) 2002, intelligence press, inc",FALSE
we are firm on the construction numbers given to you previously and we have= had a number of additional costs which we have been able to absorb in the = overall construction budget,FALSE
morgan downgraded to mkt perform from lt buy 03/22/2001 robertson stephens downgraded to lt attractive from buy 03/20/2001 frost securities coverage initiated at buy 03/14/2001 needham & company coverage initiated at hold 03/12/2001 salomon smith barney downgraded to outperform from buy 03/06/2001 banc of america downgraded to buy from strong buy 02/20/2001 csfb downgraded to hold from buy 01/29/2001 soundview upgraded to strong buy from buy 01/26/2001 warburg dillon reed downgraded to hold from strong buy 01/26/2001 s g cowen downgraded to neutral from buy 01/26/2001 j,FALSE
lagrasta 50% hunter shiveley 0% jean m,FALSE
background questions: please provide a brief personal history of the two principals involved in creekside,FALSE
pst kirk i've added my comments,FALSE
54% pjm (nov= ) 27,FALSE
"_____________________david coursey_____________________ hope ahead: what i learned from 2001's tragedies as years go, 2001 sucked",FALSE
please use his cob 9/25/01 p&l as his official score for this exercise and post his total on the high score table under the initials mds,FALSE
"also, we need for you to give us the breakout for the applicable groups",FALSE
"; ermis, frank; sanders, richard b",FALSE
"we are going to waive all bill payment charges for the months of november & december, 2001 to try and regain your confidence (and support)",FALSE
"thank you, phillip -----original message----- from: ""simpkins, michelle"" <msimpkins@winstead",FALSE
00 megawatts were exchanged as low as 207,FALSE
"after broker fees and a title policy, i would net around $20k cash",FALSE
"com>@smtp@enronxgate, marc phillips, gus eghneim, mark palmer, philip davies, nailia dindarova, richard lewis, john chappell, tracy ralston, maureen mcvicker x-cc: x-bcc: x-folder: \phillip_allen_june2001\notes folders\all documents x-origin: allen-p x-filename: pallen",FALSE
"</o=enron/ou=na/cn=recipients/cn=jtholt>, tycholiz, barry </o=enron/ou=na/cn=recipients/cn=btychol>, wilkes, corey </o=enron/ou=na/cn=recipients/cn=cwilkes>, wolfe, jason </o=enron/ou=na/cn=recipients/cn=jwolfe> x-cc: x-bcc: x-folder: \pallen (non-privileged)\allen, phillip k",FALSE
"In the following chart, please indicate your availability.",TRUE
subject: enron' s august baseload physical fixed price transactions as of 07/27/01 i apologize for not sending yesterday's information,FALSE
"50, while zones g and a fell $3",FALSE
59 sector computer and technol -20,FALSE
Please include Pat and Stella also in the discussion.,TRUE
"Chris Germany, please reserve conference room for up to people for hour on Wednesday.",TRUE
"Shemin, let me know what is our Dominion status by tomorrow.",TRUE
"; rohauer, tanya; williams, jason r (credit) subject: nine energy services matt, as we discussed several times previously, including earlier this week, nine energy services llc is a credit watch counterparty and a wmbe (women and minority owned business enterprises), which means that all trades need to be approved by credit and documented with a resale agreement",FALSE
brown/internal/accenture@accenture cc: 10/29/2001 09:02 am subject: re: confirmation: risk management simulation meeting 10/30/01 please send more details regarding this meeting -----original message----- from: monica,FALSE
"still, the american gas association offered assurances that supplies would be sufficient",FALSE
"; hearn iii, ed b",FALSE
com resource name : vpn resource type : applications,FALSE
"; grigsby, mike; holst, keith; iferc liane kucher (e-mail); kdoole - publication distribution (e-mail); keavey, peter f",FALSE
my assistant is ina rangel,FALSE
on to various internet sites 4,FALSE
Generate enough revenue for power purchases.,TRUE
spot gas at the chicago city gate sold an average of 80 cents less at $7,FALSE
"25 end table western power spot prices sink amid weather-related demand los angeles, may 14 (bloomberg energy) -- most western u",FALSE
"trs' net revenues rose two percent, as growth in loans and fee reven= ues were partly offset by a three percent decline in billed business and a = 28 percent fall in travel sales",FALSE
Please ask your contact if she can find phone number for Burt Shears.,TRUE
"jeff, i reviewed your revised offer sheet",FALSE
Check out SageOnline where top financial industry professionals answer your questions and ask them about it.,TRUE
"scott, i emailed your question to a friend that works for the new company",FALSE
"""it's likely to cause problems all week, since it's hot here and down in spp (the southwest power pool)",FALSE
my underlying goal is to create position managers and p&l reports that represent all the risk held by the desk and estimate p&l with great accuracy,FALSE
the spinning bikes are so much better than the life cycles,FALSE
"jdrf cyber auction - the cyber auction will take place this wednesday, october 24th, through thursday, october 25th",FALSE
i know all of you are concerned about the continuing decline in our share price,FALSE
"</o=enron/ou=na/cn=recipients/cn=ssouth>, rangel, ina </o=enron/ou=na/cn=recipients/cn=irangel>, tholt, jane m",FALSE
"to ensure that you receive it right away, click here now ! don't delete this email",FALSE
plug power cuts jobs full story,FALSE
--from the publisher = [image] [image]read more our price: $42,FALSE
