sentence,actionable_item
Make recommendations including budgets.,TRUE
00 east coast nepool 90,FALSE
"David, Please change the date on the draft so that we won't confuse it with the prior drafts.",TRUE
"christian yoder and steve hall are reviewing the contracts to analyze any ""out clauses"" that the buyer and/or the seller might have under the contract provisions",FALSE
"for further assistance with unsubscribing, yo= u=20 may contact a yahoo! delivers representative by email by clicking here",FALSE
Let me know as soon as you Take Allen Parkway to Shepherd.,TRUE
"on a different note, kelsey is at t bar m camp this week",FALSE
thank you! kathie grabstald x 3-9610,FALSE
"even if he wants to swich to bi-weekly, he needs to pay at the beginning of the two week period",FALSE
subject: bishops corner phillip; i see that you talked to andrew this afternoon so that you have an understanding of where we are on that front,FALSE
"my only comment is that george and larry might object to the language that ""the bank that was requested to finance the construction of the project declined to make the loan based on the high costs of the construction of the project""",FALSE
16% foreign indices close change % change arg merval 251,FALSE
"(3) impact of the adoption of statement of financial accou= nting standards (""sfas"") no",FALSE
40 # of est= imates 12 9 17 17 low estimate $0,FALSE
35 year ago = eps $0,FALSE
results for the third quarter were negatively aff= ected by two significant items: a previously announced restructuring charge= of $352 million pre-tax ($232 million after-tax) and the impacts from the = september 11th terrorist attacks,FALSE
Talk with Kay regarding option conveyance document and lease agreement.,TRUE
"</o=enron/ou=na/cn=recipients/cn=pallen>, bhatia, randy </o=enron/ou=na/cn=recipients/cn=rbhatia>, ermis, frank </o=enron/ou=na/cn=recipients/cn=fermis>, frank, carole </o=enron/ou=na/cn=recipients/cn=cfrank2>, gay, randall l",FALSE
"Megan, watch the whole thing I'm not going with AEP.",TRUE
"cooper, this is the website i use: http://ectpdx-sunone/~ctatham/navsetup/index",FALSE
"try 3 non-microsoft ways to manage passwords sure, it's a pain trying to remember your username and password for the numerous web sites you visit each day, but microsoft's new passport service is not the only solution",FALSE
i am not discounting those services,FALSE
pst the new year has arrived and we really to finalize a lot of the work with regards to moving into netco,FALSE
Please check your client bill and let us know whether you agree or disagree with the bill details.,TRUE
com takes your privacy seriously,FALSE
", this neighborhood retail center is in one of austin's most affluent areas",FALSE
the kuo's have been away on vacation,FALSE
"* requires change = of state-to-state long distance carrier to sprint, remaining a customer for= 90 days and completion of redemption certificate sent by mail",FALSE
wendy butters is the contact person,FALSE
wor= king gas in storage up 63 bcf full story,FALSE
if you want to modify this letter let me know,FALSE
Please review and let me know when this has been accomplished and will retry to download in Unify.,TRUE
"backout: we are only taking the services down on these machines no patches or upgrades, do not expect to see any problems",FALSE
i would like to see the progress on the house we looked at and tour the one we didn't have time for,FALSE
"=20 =09 =09 =09 =09market brief =09 =09monday, may 14 =09 =09stocks =09close =09change =09% change =09djia =0910,877",FALSE
the structu= re is expected to be in place in the first quarter of 2002,FALSE
Please review this and let me know how can we live with these warranty provisions.,TRUE
"larry, just a note to touch base on the sagewood townhomes and other development opportunities",FALSE
the battle over which dvd format will become the industry standard wages on,FALSE
it was easy to work with > much like painting in water colors on a large scale,FALSE
html making sense of wireless standards http://www,FALSE
backlogs in ge's power systems group almost tripled to $25 billion in the late 1990s as scores of utilities and freestanding power producers ordered natural gas turbines to supply the nation's growing appetite for electricity,FALSE
"if there are no questions, please sign the amendment and fax it me at (512) 370-2850",FALSE
mirant completes deal with el paso full story,FALSE
13 (bloomberg energy) -- electricity prices in the u,FALSE
"mark, here is a spreadsheet detailing our september socal trades",FALSE
i think steven wolf is the person to talk to about moving kim olinger to a different rc code,FALSE
"should this be the case, please e-mail (or phone) the information to us and we will remove this information right away",FALSE
09% foreign indices close chang= e % change arg merval 320,FALSE
"the primary objectives of the session are to 1) provide you with the latest information on emissions regulation, markets, and enron's advocacy efforts worldwide and 2) receive feedback on your commercial interests and input on policy options so that we may develop the best business and policy strategies for enron in both the short and long term",FALSE
"subject:=09bishops phillip, i am trying to press bank to get the deed of trust to you",FALSE
i was working on submitting it to you and rather then recreate it i should just have you send it back to me to fill in the new draw totals,FALSE
"Terry, see several deals out there for Beldan and Blake all at NYSEG but with different prices.",TRUE
lunch - fajita lunch with all the trimmings provided by taquera del sol for $5,FALSE
Let's discuss and call Paul Myford after you complete your review.,TRUE
"us stocks cross-listed on european exchanges were hit hard, especially airlines, insurance, and financials",FALSE
"com =09[image] =09 =09 jds uniphase corporation(jdsu) [image] view today's earni= ngs announcements earnings date upcoming announcement october 25, 20= 01 after market add this event to my calendar upcoming conference ca= ll october 25, 2001 4:30pm [image] add this event to my calendar last con= ference call july 26, 2001 4:30pm click to listen note: all times are e= astern standard time (est) consensus eps estimate this qtr jun 2001 nex= t qtr sep 2001 this fiscal year jun 2001 next fiscal year jun 2002 avg esti= matem (mean) $0",FALSE
"for more information, see: http://interactive",FALSE
"we had one thing in common: when bill talks, we write about it",FALSE
i have discussed this with jeff and he is following it up,FALSE
"and big gas consumers, from utilities to companies such as farmland industries inc",FALSE
"jean, dave forster is out of town",FALSE
a replay of the conference call also will be avai= lable today at the same web site address,FALSE
this report is a must-have for investors interested in tech stocks,FALSE
in my case this would be as= of september 30th,FALSE
"50, he is expecting the aeco curve to widen to down 0",FALSE
this message was not sent unsolicited,FALSE
the biggest difference is 9/14 ($500 million),FALSE
"jeff, i understand you spoke to jacques craig about the consent and assignment documents",FALSE
matt lutz was supposed to email me some language but i did not receive it,FALSE
"if you have any questions or need any assistance, please give me x53847 or sarah zarkowsky(an assoc in my group) x53791a call",FALSE
html crm vendors don't walk the talk http://chkpt,FALSE
"greg, here are my comments and questions on the cost estimates: cost per square foot seem too low for construction $33",FALSE
the company's adjusted return on equity was 16,FALSE
",= all rights reserved about us | contact us | webmaster | site map pr= ivacy policy | terms of service =09",FALSE
com for: we hope you enjoyed receiving this message,FALSE
i will have the operating statements complete through december by this friday,FALSE
"80 nikkei below 10,000 and lower than dow for first time since 1950s, now at dec 1983 levels (w/o accounting for mar",FALSE
please debug mixed-signal product test specifications and let me know the patterns.,TRUE
doc) this message is for the designated recipient only and may contain privileged or confidential information,FALSE
would it possible to add the prior day for each of the dates below to the pivot table,FALSE
this note is authorization to make the following changes: 1,FALSE
we are continuing to have meetings with oei to discuss our producer one product as well as evaluating oei's havre pipeline system in montana for a pipeline outsourcing opportunity,FALSE
""" jokes, the prototype of which being ""i used to be a barber, but i just couldn't cut it",FALSE
would only serve to fuel the fires of the naysayers- i would delete,FALSE
anderson will start against a patriots team that has been surprisingly effective against the run at times,FALSE
enron will also discontinue subsidized internet service,FALSE
"14 balance to fund cash $ 277,099",FALSE
"= the two-steps-forward, one-step-backward recovery since september 21 hasn= 't created the enthusiasm that would necessitate an early, nasty correctio= n",FALSE
"greg, i went to the title company yesterday and as instructed by irwin i signed t= he deed of trust, the promissory note for 8",FALSE
witi is the first and only international organization solely dedicated to advancing women through technology,FALSE
"Let me know as soon as you can so we can make sure the gas is allocated correctly for September, and so it can set it up for October if need be.",TRUE
i am waiting to hear from her,FALSE
but that doesn't mean it's going to be a flop,FALSE
these seminars will cover the basics of increasing revenues and profits while providing insight on how real-time data can be used to forecast demand elasticity and optimize profits,FALSE
outline) that will support the topics document,FALSE
6 its gas power plants won't compete with coal for years chesapeake energy 0,FALSE
"wade, i understood your number one priority was to deal with your vehicle situation",FALSE
Please organize incoming claims data for effective retrieval.,TRUE
Please develop client product and underwriting files according to company standards.,TRUE
this information has been extremely critical this year due to the pipeline explosion and size of the west desk positions,FALSE
"pst effective monday, october 22, 2001 the following changes will be made to the autohedge functionality on enrononline",FALSE
"andrew, here is an asset statement",FALSE
"__________________________________ business alert from the wall street journal sunday, nov",FALSE
Please review the enclosed and advise of any additional comments.,TRUE
=09 =09dpl to add 160 mw in ohio by 2002 =09go to full story,FALSE
the clubhouse floorplan looks good,FALSE
Brenda Please put this on Dicks calendar and the desk calendar to make others know the meeting dates.,TRUE
see more information at: http://interactive,FALSE
"the capitol connection offers ferc meetings live via the internet, as well as via phone bridge, and satellite, please visit our website at www",FALSE
this would still only require $75k cash from the buyer,FALSE
"</o=enron/ou=na/cn=recipients/cn=kkelly>, franklin, cynthia </o=enron/ou=na/cn=recipients/cn=cfrankl>, khandker, dayem </o=enron/ou=na/cn=recipients/cn=dkhandke>, thorne, judy </o=enron/ou=na/cn=recipients/cn=jthorne>, jennings, jennifer </o=enron/ou=na/cn=recipients/cn=jjenning>, phillips, rebecca </o=enron/ou=na/cn=recipients/cn=rphilli>, grass, john </o=enron/ou=na/cn=recipients/cn=jgrass>, ferries, nelson </o=enron/ou=na/cn=recipients/cn=nferrie>, ring, andrea </o=enron/ou=na/cn=recipients/cn=aring>, ortiz, lucy </o=enron/ou=na/cn=recipients/cn=lortiz>, martin, thomas a",FALSE
"greg, please call or email with an update on bank one and permitting process",FALSE
"jeff, i got your voice mail about the school board",FALSE
h= ambrecht coverage initiated at buy briefing,FALSE
"go to options, e-reports for a list of every e-report that you are currently receiving, along with the days they are sent to you",FALSE
"Due to the Bid Week window, please approve this bridge enhancement for tonight's migration.",TRUE
this request has been pending your approval for 6 days,FALSE
"cost is $25 for enron employees, spouses, retirees and eds; $85 for contractors",FALSE
Please call me to discuss the SPA once you have reviewed the appropriate documents.,TRUE
00 (30%) [image]see more titles about tools [image] garde= n [image] [image] cultivating delight: a natural history of my garden= icon by diane ackerman diane ackerman relishes the world of her gard= en,FALSE
pst team here are my comments on options (see attachment below),FALSE
"today's rapid increase was likely induced by traders who used today's news to gain momentum for future increases, traders said",FALSE
i have one other investor in addition to keith that has interest,FALSE
") those new gas plants were supposed to steal business from pollution-spewing coal units, which still supply half the nation's electricity",FALSE
"the main difference in committing to a= greater loan is that our costs of points will rise and our equity may be o= ut of balance in the end, vs",FALSE
html ---------------------------------------------------------- privista is teamed with equifax secure your credit,FALSE
backout: backout patches and config changes and reboot to old configuration,FALSE
"> > hope this helps you out, > > matt kizziah >",FALSE
com is the leading internet provider of live market analysis for u,FALSE
Please assist in determining pricing quotes for customers.,TRUE
44 amid trades in the $28,FALSE
com is cashing in on viruses http://chkpt,FALSE
the futures contracts are bought and sold for delivery of natural gas as soon as next month or as far ahead as three years,FALSE
com> 09/13/2001 07:07 pm cc: donald l,FALSE
"just click here to find out how to receive your grocery coupons now! i must hear from you immediately though, we are holding the coupons for you, phillip",FALSE
"> (or any of its affiliates) and the intended recipient or any > other party, and may not be relied on by anyone as the basis of a > contract by estoppel or otherwise",FALSE
"at the top of the list: microsoft's xbox launch, handhelds for the open-source crowd, and ebay's second dip into the sauce",FALSE
Please analyze and prepare revenue reports expense reports and other business transaction reports.,TRUE
org and select the ferc link or you can go to the ferc web page at www,FALSE
"3 shares to be distributed for every= share in the account on january 1, 2001",FALSE
"council member jane hughso= n supported the idea of removing the rr 12 curb cut allowance from the sect= or plan, but evaluating a developer's plans for possibly locating one in th= e area as development proceeds",FALSE
"after loading shockwave, shut down and reopen browser (i",FALSE
a handheld that talks back http://www,FALSE
request a free quote without ever leaving home!= acura am general aston martin audi bentley bmw buick cadillac chevrolet c= hrysler daewoo dodge ferrari ford gmc honda hyundai infiniti isuzu jaguar j= eep kia lamborghini land rover lexus lincoln lotus mazda mercedes-benz merc= ury mitsubishi nissan oldsmobile plymouth pontiac porsche rolls-royce saab = saturn subaru suzuki toyota volkswagen volvo sell your car for more with = autoweb classifieds use our classified ads to reach over 3 million poten= tial car buyers,FALSE
Please check out with TEP when you are aware of the new sink.,TRUE
"to view your trade confirmation(s) online, click on the link below",FALSE
guests and analysts answer your q= uestions,FALSE
i will fill in the legal > description of the property one i have received it,FALSE
"they are unhedged 15,000/d in 2003 and 25,000/d in 2004 and 2005",FALSE
"click here for contract agenda tuesday, dec",FALSE
"[image]get approved for an unsecured gold credit card instantly online! now you can get guaranteed instant online approval for an unsecured gold credit card with a $5,000 credit line",FALSE
"linda, please remove my name from your distribution list, and add on kathy's to increase the balance the lists.",TRUE
i am going to be in san marcos this weekend but i am booked with stage coach,FALSE
Please manage change requests for customer accounts.,TRUE
this request has been pending your approval for 52 days,FALSE
"gif"" width=""1"" height=""28"" border=""0""></td> </tr> <tr valign=""top""><!-- row 5 --> <td><a href=""http://www",FALSE
they are going to cancel and prorate my policy and work with the kuo's to issue a new policy,FALSE
""") to start in high gear: as an introductory token of our = appreciation we're giving you a free $5",FALSE
com subject: conference call today with ferc staff mime-version: 1,FALSE
"lucy, you wrote fewer checks this month",FALSE
"""dailies and the bal(ance of) week are both stronger because of that",FALSE
"smart deals, just a c= lick away! =09 [image]",FALSE
"however, she wants to get your signed permission to transfer their ownership interests to the j&p kuo, ltd",FALSE
"but if you knew the damage even one unsavory employee could do, you might think twice",FALSE
"com>, kaminski, vince j </o=enron/ou=na/cn=recipients/cn=vkamins>, kean, steven j",FALSE
they look good at first glance,FALSE
"thanks, phillip allen -----original message----- from: ""tony roberts"" <troberts@dyalroberts",FALSE
Please check each document and forward to the counterparty for their execution and return.,TRUE
Email me with latest happenings with you in the big city.,TRUE
sometimes the best way to go car shopping is with money in-hand to= serve as a bargaining tool,FALSE
"electricity, charles studness, president of studness research, found quite the opposite could happen",FALSE
"i agree that we will not consent to the assignment unless the release and utility issue are resolved, but i would prefer to get the utility and release resolved without waiting for the 1st lienholder to consent",FALSE
i expect to have that done by friday,FALSE
82 # of estimates 20 19 24 21 low estimate $0,FALSE
but the file says she moved in on 1/30,FALSE
75= % cob (nov) 29,FALSE
"jacques, the assets and liabilities that we are willing to assume are listed below: assets: land preliminary architecture design-kipp flores architects preliminary engineering-cuatro consultants, ltd",FALSE
2 billion but the theoretical curve shift was -13 million,FALSE
"t, the procedure for calling enron's houston offices from international locations, excluding canada, using the 800-97-enron phone number will change",FALSE
"</o=enron/ou=na/cn=recipients/cn=bprice>, reck, daniel </o=enron/ou=na/cn=recipients/cn=dreck>, reeves, leslie </o=enron/ou=na/cn=recipients/cn=lreeves>, ring, andrea </o=enron/ou=na/cn=recipients/cn=aring>, shackleton, sara </o=enron/ou=na/cn=recipients/cn=sshackl>, shankman, jeffrey a",FALSE
"-----original message----- from: ""richard toubia"" <richard",FALSE
the daily numbers for 2000 do not include middle market orig,FALSE
84% commodities close change % change crud= e oil (dec) 22,FALSE
"cpr and first aid certification cpr and first aid certification is being offered on thursday, november 15, 2001, from 1:30 p",FALSE
"but if they get on the right side of a price trend, traders don't need to know much about gas -- or whatever commodity they're trading",FALSE
we'll call ina with the room for next friday,FALSE
"proposed agenda for tomorrow: update- request for rehearing of 6/19 order claim for refunds made by pnw utilities caiso order of chief judge scheduling settlement conference,docket er01-2019-000 motion for refunds of ca parties and pacific gas and electric consumers union",FALSE
answer - gg dillon is a must-start player every week,FALSE
Email me back with your pick so that we can proceed further.,TRUE
"southern day-ahead power traded $2 higher at a bloomberg index of $37, amid trades in the $35-$39 range",FALSE
you can reach me at 713-853-7041(w) or 713-463-8626(h) phillip allen,FALSE
Theresa please consider sending rep for market trials requirements and possible settlement issues.,TRUE
i will need to get contracts signed at this point as soon as possible,FALSE
com) event sponsor: > southwest bio conference - december 4-5 @hyatt downtown ( http://www,FALSE
but i wanted to suggest something in case the variance was not granted,FALSE
"box 15427 austin, tx 78761-5427 policy #cbi420478 contact: jeanette peterson (512)451-6551 the actual policy is signed by vista insurance partners",FALSE
in the cash flow impact case 2 & 3 already account for additional cut of 100k from existing cost,FALSE
"By next meet, let me know what is reasonable and if there is anything can do to assist in expediting the process.",TRUE
"; kaminski, vince j; bradley, michael; kean, steven j",FALSE
> > al pollard > > > > > > ********************************************************************** > this e-mail is the property of enron corp,FALSE
com for all your automotive needs,FALSE
Please send me your Assistants name and number so can schedule time for you and Kevin for meeting next week.,TRUE
"5 out of 5 stars showtimes: 1:05pm | 2:05pm | 4= :00pm | 5:00pm | 7:00pm | 8:00pm | 9:55pm | 10:55pm | 12:45am behind = enemy lines pg-13owen wilson, gene hackman average customer review: 4 o= ut of 5 stars showtimes: 12:25pm | 2:55pm | 5:20pm | 7:50pm | 10:15pm | = 12:40am harry potter and the philosopher's stone pgdaniel radcliffe, = rupert grint average customer review: 4",FALSE
"power prices fall as offers continue to outweigh bids london, may 14 (bloomberg energy) -- power prices in the u",FALSE
Please start the deliveries on the 10th and inform to all.,TRUE
monday everyone that does not have a steno will,FALSE
"richard, compare your california production to the numbers in the 2000 california gas report",FALSE
Check if Tetco allocated the vol to their contract.,TRUE
the= company is in the final stages of implementing a cost structure to drive b= reak even at a quarterly revenue level well below us$4 billion,FALSE
Execute features in a well document robust and readable manner and pass to the team.,TRUE
"in light of this and the u= ncertainty regarding the potential impacts of events taking place in the wa= ke of the september 11, 2001 tragedies and their effect on economies and bu= sinesses around the world, we are not providing guidance for the fourth qua= rter of 2001 or the full year 2002 at this time,"" concluded dunn",FALSE
customers =09go to full story,FALSE
"your earlier response answered the questions for #3,11,15,20a, and 35",FALSE
"the course will be held in austin, texas",FALSE
please call to discuss cash award,FALSE
take control of your = remote tune in to yahoo! tv for what 's new on the tube,FALSE
"phillip, barry had said that you were asking about getting a pivot table for the wscc new generation data",FALSE
"gif"" width=""1"" height=""1"" border=""0""></td> </tr> <tr valign=""top""><!-- row 1 --> <td><a href=""http://www",FALSE
Please check out each of the above web sites and let me know what changes you are planning to do.,TRUE
9 $4 billion in debt; heavy gas-drilling exposure *latest 12 months,FALSE
the contract has fallen by 1,FALSE
let me know if you want a copy faxed,FALSE
"""prices into tva started in the $80s and $90s and crumbled as forecasts came out,"" said on entergy power trader",FALSE
Reserve the below date on your schedule for Tuesday and please attend the training.,TRUE
backout: load a different ios,FALSE
com/ to order now return the form below via fax #954-340-1917 ------------------------------------------------------------------ begin order form ------------------------------------------------------------------ products or services order form [x] place an x in the appropriate box for each product you want,FALSE
we all had too many mylanta moments and we need to drink it up,FALSE
"most of his houses are texas style with solid rock walls, standing seam roofs, antique wood flooring, cabinets, etc",FALSE
jeff has unparalleled qualifications and a deep and thorough understanding of enron,FALSE
hope you can join us - picture,FALSE
sometimes we even hit the trails in memorial park on saturdays,FALSE
=09 [image]=09 =09 =09 =09 =09 =09get the best of the las vegas strip for pennies on the dollar! 10= 0 vegas vacations up for auction with bids starting at $1,FALSE
"One of you, order the tickets today over the phone or on the internet.",TRUE
"-----original message----- from: ""greg thorse"" <gthorse@about-cis",FALSE
lu= koil-odessa begins sale of jet fuel in ukraine full story,FALSE
"""there was nothing going on in florida today,"" said one southern energy trader",FALSE
"; ermis, frank; reitmeyer, jay; scott, susan m",FALSE
i am under the impression that the panels will prevent the upstairs from feeling significantly hotter than the downstairs as most two story homes do,FALSE
subject: bishops corner see attachement - phillip & kieth lender decision 6,FALSE
"thanks! adrianne -----original message----- from: allen, phillip k",FALSE
"unauthorized copying, electronically or otherwise, of the report is a violation of federal law",FALSE
2 affirmative fair housing marketing plan,FALSE
Please check with our office before sending any western union as our sending information occasionally changes.,TRUE
"29 to approve this expense report, click on the following link for concur expense",FALSE
com> - utility construction escrow am (amhpleander),FALSE
tax credit statement please send me the original blue ink excuted copes of these four documents,FALSE
"00, now released its massive 11 disc set with over 150 million database records (18 gigabytes) for companies, people, email, fax, phone and mailing addresses worldwide! complete 11 disc set will be sold for $499",FALSE
"as folks are aware, we have been engaged in closed-door negotiations for the past two weeks regarding a possible market-based solution to california's electricity crisis",FALSE
00 in name-brand grocery coupons today! only phillip may claim these free coupons,FALSE
